experiment_id	val_auc	status	variable_changed	value_tested	fixed_conditions	confidence_note
1	0.996179	discard	model	logistic_regression_baseline	frozen model, seed 42, 80/20 split	no confidence note provided
2	0.840395	discard	feature selection	drop leaky features baseline	seed 42, 80/20 split	leakage audit
3	0.703883	baseline	feature selection	leakage-free baseline	seed 42, 80/20 split, dropped leaky cols	leakage audit
4	0.721055	keep	classifier	RandomForestClassifier_n100	seed 42, 80/20 split, dropped leaky cols, imputer median	first run
5	0.744975	keep	classifier	GradientBoostingClassifier_n100	seed 42, 80/20 split, dropped leaky cols, imputer median	first run
6	0.704084	discard	class_weight	balanced	seed 42, 80/20 split, dropped leaky cols, LogisticRegression, StandardScaler, imputer median	first run
7	0.746527	keep	n_estimators	200	seed 42, 80/20 split, dropped leaky cols, GradientBoostingClassifier, imputer median, lr=0.1, max_depth=3	first run
8	0.751013	keep	max_depth	4	seed 42, 80/20 split, dropped leaky cols, GradientBoostingClassifier, n_estimators=200, imputer median, lr=0.1	first run
9	0.750967	discard	learning_rate	0.05	seed 42, 80/20 split, dropped leaky cols, GradientBoostingClassifier, n_estimators=200, max_depth=4, imputer median	first run
10	0.750013	discard	subsample	0.8	seed 42, 80/20 split, dropped leaky cols, GradientBoostingClassifier, n_estimators=200, max_depth=4, lr=0.1, imputer median	first run
11	0.748285	discard	n_estimators	300	seed 42, 80/20 split, dropped leaky cols, GradientBoostingClassifier, max_depth=4, lr=0.1, imputer median	first run
12	0.747884	discard	min_samples_leaf	4	seed 42, 80/20 split, dropped leaky cols, GradientBoostingClassifier, n_estimators=200, max_depth=4, lr=0.1, imputer median	first run
13	0.750999	discard	preprocessor	QuantileTransformer_normal	seed 42, 80/20 split, dropped leaky cols, GradientBoostingClassifier, n_estimators=200, max_depth=4, lr=0.1	first run
14	0.746938	discard	feature_engineering	PolynomialFeatures_degree2_interaction_only	seed 42, 80/20 split, dropped leaky cols, GradientBoostingClassifier, n_estimators=200, max_depth=4, lr=0.1	first run
15	0.751392	keep	preprocessor	RobustScaler	seed 42, 80/20 split, dropped leaky cols, GradientBoostingClassifier, n_estimators=200, max_depth=4, lr=0.1	first run
16	0.75099	discard	learning_rate	0.05	seed 42, 80/20 split, dropped leaky cols, GBC, n_estimators=200, max_depth=4, RobustScaler	retry with RobustScaler
17	0.739946	discard	learning_rate	0.2	seed 42, 80/20 split, dropped leaky cols, GBC, n_estimators=200, max_depth=4, RobustScaler	first run
18	0.747243	discard	max_depth	5	seed 42, 80/20 split, dropped leaky cols, GBC, n_estimators=200, lr=0.1, RobustScaler	first run
19	0.752348	keep	max_features	sqrt	seed 42, 80/20 split, dropped leaky cols, GBC, n_estimators=200, max_depth=4, lr=0.1, RobustScaler	first run
20	0.751953	discard	subsample	0.8	seed 42, 80/20 split, dropped leaky cols, GBC, n_estimators=200, max_depth=4, max_features=sqrt, lr=0.1, RobustScaler	first run
21	0.752913	keep	n_estimators	300	seed 42, 80/20 split, dropped leaky cols, GBC, max_depth=4, max_features=sqrt, lr=0.1, RobustScaler	first run
22	0.752056	discard	n_estimators	400	seed 42, 80/20 split, dropped leaky cols, GBC, max_depth=4, max_features=sqrt, lr=0.1, RobustScaler	first run
23	0.751295	discard	min_samples_split	5	seed 42, 80/20 split, dropped leaky cols, GBC, n_estimators=300, max_depth=4, max_features=sqrt, lr=0.1, RobustScaler	first run
24	0.746406	discard	classifier	HistGradientBoostingClassifier_defaults	seed 42, 80/20 split, dropped leaky cols, no scaler, handles missing natively	first run
25	0.746771	discard	HistGBC_max_iter_max_depth	max_iter=300_max_depth=4	seed 42, 80/20 split, dropped leaky cols, HistGBC, lr=0.1	first run
26	0.721878	discard	classifier	RandomForest_n300_max_features_sqrt_RobustScaler	seed 42, 80/20 split, dropped leaky cols, imputer median	first run
27	0.749661	discard	max_depth	3	seed 42, 80/20 split, dropped leaky cols, GBC, n_estimators=300, max_features=sqrt, lr=0.1, RobustScaler	first run
28	0.747472	discard	max_features	0.5	seed 42, 80/20 split, dropped leaky cols, GBC, n_estimators=300, max_depth=4, lr=0.1, RobustScaler	first run
29	0.750307	discard	learning_rate+n_estimators	lr=0.05_n=500	seed 42, 80/20 split, dropped leaky cols, GBC, max_depth=4, max_features=sqrt, RobustScaler	compensate lower lr with more trees
30	0.700735	discard	classifier	ExtraTreesClassifier_n300_sqrt	seed 42, 80/20 split, dropped leaky cols, imputer median	first run
31	0.723133	discard	classifier+features	LogisticRegression_C0.1_poly2	seed 42, 80/20 split, dropped leaky cols, RobustScaler, PolynomialFeatures degree=2	first run
32	0.746604	discard	classifier	VotingClassifier_soft_GBC_RF	seed 42, 80/20 split, dropped leaky cols, RobustScaler, imputer median	first run
33	0.751356	discard	min_samples_leaf	2	seed 42, 80/20 split, dropped leaky cols, GBC, n_estimators=300, max_depth=4, max_features=sqrt, lr=0.1, RobustScaler	first run
34	0.743804	discard	ccp_alpha	0.0001	seed 42, 80/20 split, dropped leaky cols, GBC, n_estimators=300, max_depth=4, max_features=sqrt, lr=0.1, RobustScaler	first run
35	0.752876	discard	preprocessor	no_scaler	seed 42, 80/20 split, dropped leaky cols, GBC, n_estimators=300, max_depth=4, max_features=sqrt, lr=0.1	ablation: confirm RobustScaler effect
36	0.71561	discard	classifier	StackingClassifier_GBC+RF_LR-meta_cv3	8 features, GBC n300 depth4 sqrt RobustScaler, seed 42, 80/20 split	8-feature set post-leakage-fix
37	0.711301	discard	loss	exponential	8 features, GBC n300 depth4 sqrt RobustScaler, seed 42, 80/20 split	8-feature set post-leakage-fix
38	0.714265	discard	n_iter_no_change	20	8 features, GBC n300 depth4 sqrt RobustScaler, seed 42, 80/20 split	8-feature set post-leakage-fix
39	0.714093	baseline	feature_set	8-feature-set-post-leakage-fix	GBC n300 depth4 sqrt lr=0.1 RobustScaler, seed 42, 80/20 split	new baseline after removing num_investors+num_distinct_investors as leaky
40	0.71154	discard	preprocessing	VarianceThreshold_drop_4_dead_features	GBC n300 depth4 sqrt RobustScaler 8feat->4feat seed42	4 features had zero variance confirmed by EDA
41	0.710812	discard	max_features	None_all_features_per_split	GBC n300 depth4 RobustScaler 8feat 4real seed42	dead features have 0 gain so effectively all 4 real features compete per split
42	0.716829	keep	imputer_missing_values	missing_values=-1_treat_sentinel_as_NaN	GBC n300 depth4 sqrt RobustScaler 8feat seed42	beats 8-feat baseline 0.714093; run.py compared against stale leaky best
43	0.716829	discard	confirm_baseline	GBC_n300_depth4_clean_rerun	GBC n300 depth4 sqrt lr=0.1 RobustScaler 8feat sentinel_imputer seed42 80/20	re-confirmed clean baseline; tied with exp 42, not an improvement
44	0.719277	keep	max_depth	3	GBC n300 max_features=sqrt lr=0.1 RobustScaler 8feat sentinel_imputer seed42 80/20	shallower trees improve on clean feature set
45	0.709298	discard	max_depth	5	GBC n300 max_features=sqrt lr=0.1 RobustScaler 8feat sentinel_imputer seed42 80/20	deeper trees overfit on clean 8-feature set
46	0.720256	keep	learning_rate+n_estimators	lr=0.05_n=500	GBC depth3 max_features=sqrt RobustScaler 8feat sentinel_imputer seed42 80/20	slower lr compensated by more trees improves AUC
47	0.71944	discard	learning_rate+n_estimators	lr=0.03_n=800	GBC depth3 max_features=sqrt RobustScaler 8feat sentinel_imputer seed42 80/20	too slow lr hurts; diminishing returns beyond n=500
48	0.72028	keep	n_estimators	600	GBC depth3 lr=0.05 max_features=sqrt RobustScaler 8feat sentinel_imputer seed42 80/20	slight gain from additional trees at lr=0.05
49	0.719792	discard	subsample	0.8	GBC n600 depth3 lr=0.05 max_features=sqrt RobustScaler 8feat sentinel_imputer seed42 80/20	stochastic subsampling does not help on small clean feature set
50	0.720502	keep	min_samples_leaf	4	GBC n600 depth3 lr=0.05 max_features=sqrt RobustScaler 8feat sentinel_imputer seed42 80/20	leaf regularization marginally improves; final best model
51	0.718855	discard	max_features	0.6	GBC n600 depth3 lr=0.05 min_samples_leaf=4 RobustScaler 8feat sentinel_imputer seed42 80/20	wider feature fraction hurts; sqrt remains optimal
52	0.718338	discard	imputer_strategy	mean	GBC n600 depth3 lr=0.05 min_samples_leaf=4 max_features=sqrt RobustScaler 8feat seed42 80/20	mean imputation worse than median for heavy-tailed seed funding amounts
